{
  "problem": "mub-six",
  "route_status": "EVIDENCE",
  "route_summary": "Four MU bases in C^6 not found in 25,000 starts by two implementations; the dominant floor L* (ASD 0.99829169) is a nondegenerate local minimum modulo gauge (two independent Hessians) with exact cubic-field overlap values, rediscovering Raynal-Lu-Englert's optimum. With three bases the same floor is a one-parameter valley.",
  "attempts": [
    {
      "id": "001",
      "file": "attempts/001-multistart-defect-landscape.md",
      "date": "2026-10-02",
      "mode": "blind",
      "status": "EVIDENCE",
      "range": "22,000 random starts of projected-gradient descent on 4 bases of C^6 (seeds 7 and 20261002, 50,000-iteration cap); controls d=2..7 under identical settings",
      "mechanism": [
        "optimization-landscape-census",
        "unitary-manifold-descent",
        "positive-control-calibration",
        "frame-potential-bound"
      ],
      "one_line": "No four MU bases in C^6 across 22,000 random starts; the dominant endpoint (70.7%) reproduces the published four-basis optimum ASD 0.99829, with every residual defect between the three Hadamard bases.",
      "refuted_by": null,
      "gaps": [
        "Floor not certified as a local (let alone global) minimum.",
        "Local search cannot exclude a narrow basin: the d=7 control finds known complete sets in only 0.7% of starts."
      ],
      "leak_terms": [
        "0.0512492189962838",
        "0.998291692700",
        "14,138",
        "0.124398",
        "0.151402"
      ],
      "target_shape": "object",
      "push_rounds": 2
    },
    {
      "id": "002",
      "file": "attempts/002-skeptic-reimplementation-of-001.md",
      "date": "2026-10-02",
      "mode": "blind",
      "status": "VERIFIED",
      "range": "001's claims about the d=6, k=4 floor value, its share of starts, its basis structure and overlap pattern, and the d=2,3,5 and d=6,k=3 controls; checked by an independent exponential-map L-BFGS implementation over 3,000 d=6,k=4 starts",
      "mechanism": [
        "adversarial-verification",
        "unitary-manifold-descent",
        "optimization-landscape-census"
      ],
      "one_line": "Independent exponential-map L-BFGS code reproduces 001's floor L = 0.0512492189962838 (71.6% of starts), its structure and its controls, with no corrections; the same value is also a 3-basis local minimum.",
      "verifies": "001",
      "refuted_by": null,
      "corrections": [],
      "leak_terms": [
        "1431/2000",
        "3-basis local minimum"
      ],
      "target_shape": "object",
      "push_rounds": 0
    },
    {
      "id": "003",
      "file": "attempts/003-floor-hessian-and-closed-form.md",
      "date": "2026-10-02",
      "mode": "blind",
      "status": "EVIDENCE",
      "range": "one four-basis floor configuration (float Hessian, 108 coordinates; 50-digit Decimal polish) and one three-basis floor valley followed to t = 0.6",
      "mechanism": [
        "unitary-manifold-descent",
        "integer-relation-detection",
        "exact-pattern-algebra"
      ],
      "one_line": "The four-basis floor is a nondegenerate local minimum modulo 23 gauge directions; its overlaps are 4c^2/3, (2c-1)^2, c(3-4c)/3 with c the root of 112c^3-144c^2+63c-9 (RLE's cubic, rediscovered blind); with three bases the same floor is a one-parameter valley.",
      "refuted_by": null,
      "gaps": [
        "Second-order claim is float evidence, not an interval certificate.",
        "k = 3 valley not identified with RLE's family; not independently re-implemented."
      ],
      "leak_terms": [
        "448c^4",
        "112c^3 - 144c^2 + 63c - 9",
        "nondegenerate local minimum modulo",
        "one-parameter valley",
        "(2c − 1)²"
      ],
      "target_shape": "mixed",
      "push_rounds": 2,
      "superseded_by": "004"
    },
    {
      "id": "004",
      "file": "attempts/004-skeptic-hessian-review-of-003.md",
      "date": "2026-10-02",
      "mode": "blind",
      "status": "VERIFIED_WITH_CORRECTIONS",
      "range": "003 claims 1-2 (critical point, 23 gauge zero modes, 85 positive directions, overlap values to 18 digits) via exact AD Hessian in a Cayley chart; not the k = 3 valley or the closed forms",
      "mechanism": [
        "adversarial-verification",
        "unitary-manifold-descent"
      ],
      "one_line": "Independent exact-AD Hessian confirms 003's signature (23 gauge zeros, 85 positive) and overlap values; corrects 003's eigenvalue magnitudes as dependent on generator normalisation and which basis is fixed.",
      "verifies": "003",
      "refuted_by": null,
      "corrections": [
        "003's quoted eigenvalue range (min 0.215, max 10.26) is specific to its non-orthonormal generators and hub-fixed gauge; Frobenius-normalised it is 0.107-5.13 (hub fixed) or 0.0916-4.72 (non-hub fixed). Only the signature is invariant."
      ],
      "leak_terms": [
        "0.0916047112",
        "hub fixed"
      ],
      "target_shape": "object",
      "push_rounds": 0,
      "methodological_lesson": "For a Hessian at a quotient, claim the signature; quote magnitudes only with gauge fixing and generator normalisation stated."
    }
  ]
}
